
*** Running vivado
    with args -log system_hw_conv_0_0.vds -m64 -product Vivado -mode batch -messageDb vivado.pb -notrace -source system_hw_conv_0_0.tcl


****** Vivado v2018.3 (64-bit)
  **** SW Build 2405991 on Thu Dec  6 23:38:27 MST 2018
  **** IP Build 2404404 on Fri Dec  7 01:43:56 MST 2018
    ** Copyright 1986-2018 Xilinx, Inc. All Rights Reserved.

source system_hw_conv_0_0.tcl -notrace
create_project: Time (s): cpu = 00:00:03 ; elapsed = 00:00:35 . Memory (MB): peak = 319.215 ; gain = 59.426
INFO: [IP_Flow 19-234] Refreshing IP repositories
INFO: [IP_Flow 19-1700] Loaded user IP repository 'c:/ece1195/labs/lab5/lab5_template/vivado/ip_repo'.
INFO: [IP_Flow 19-1700] Loaded user IP repository 'c:/ece1195/labs/lab5/Lab_5/solution1/impl/ip'.
INFO: [IP_Flow 19-2313] Loaded Vivado IP repository 'C:/Xilinx/Vivado/2018.3/data/ip'.
update_ip_catalog: Time (s): cpu = 00:00:04 ; elapsed = 00:00:35 . Memory (MB): peak = 351.051 ; gain = 31.836
Command: synth_design -top system_hw_conv_0_0 -part xc7z020clg400-1 -mode out_of_context
Starting synth_design
Attempting to get a license for feature 'Synthesis' and/or device 'xc7z020'
INFO: [Common 17-349] Got license for feature 'Synthesis' and/or device 'xc7z020'
INFO: Launching helper process for spawning children vivado processes
INFO: Helper process launched with PID 69584 
---------------------------------------------------------------------------------
Starting RTL Elaboration : Time (s): cpu = 00:00:05 ; elapsed = 00:00:07 . Memory (MB): peak = 469.863 ; gain = 96.828
---------------------------------------------------------------------------------
INFO: [Synth 8-638] synthesizing module 'system_hw_conv_0_0' [c:/ece1195/labs/lab5/lab5_template/vivado/lab5/lab5.srcs/sources_1/bd/system/ip/system_hw_conv_0_0/synth/system_hw_conv_0_0.vhd:81]
INFO: [Synth 8-3491] module 'hw_conv' declared at 'c:/ece1195/labs/lab5/lab5_template/vivado/lab5/lab5.srcs/sources_1/bd/system/ipshared/818b/hdl/vhdl/hw_conv.vhd:12' bound to instance 'U0' of component 'hw_conv' [c:/ece1195/labs/lab5/lab5_template/vivado/lab5/lab5.srcs/sources_1/bd/system/ip/system_hw_conv_0_0/synth/system_hw_conv_0_0.vhd:146]
INFO: [Synth 8-638] synthesizing module 'hw_conv' [c:/ece1195/labs/lab5/lab5_template/vivado/lab5/lab5.srcs/sources_1/bd/system/ipshared/818b/hdl/vhdl/hw_conv.vhd:37]
INFO: [Synth 8-5534] Detected attribute (* fsm_encoding = "none" *) [c:/ece1195/labs/lab5/lab5_template/vivado/lab5/lab5.srcs/sources_1/bd/system/ipshared/818b/hdl/vhdl/hw_conv.vhd:1678]
INFO: [Synth 8-5534] Detected attribute (* fsm_encoding = "none" *) [c:/ece1195/labs/lab5/lab5_template/vivado/lab5/lab5.srcs/sources_1/bd/system/ipshared/818b/hdl/vhdl/hw_conv.vhd:1681]
INFO: [Synth 8-5534] Detected attribute (* fsm_encoding = "none" *) [c:/ece1195/labs/lab5/lab5_template/vivado/lab5/lab5.srcs/sources_1/bd/system/ipshared/818b/hdl/vhdl/hw_conv.vhd:1684]
INFO: [Synth 8-5534] Detected attribute (* fsm_encoding = "none" *) [c:/ece1195/labs/lab5/lab5_template/vivado/lab5/lab5.srcs/sources_1/bd/system/ipshared/818b/hdl/vhdl/hw_conv.vhd:1687]
INFO: [Synth 8-5534] Detected attribute (* fsm_encoding = "none" *) [c:/ece1195/labs/lab5/lab5_template/vivado/lab5/lab5.srcs/sources_1/bd/system/ipshared/818b/hdl/vhdl/hw_conv.vhd:1693]
INFO: [Synth 8-5534] Detected attribute (* fsm_encoding = "none" *) [c:/ece1195/labs/lab5/lab5_template/vivado/lab5/lab5.srcs/sources_1/bd/system/ipshared/818b/hdl/vhdl/hw_conv.vhd:1697]
INFO: [Synth 8-5534] Detected attribute (* fsm_encoding = "none" *) [c:/ece1195/labs/lab5/lab5_template/vivado/lab5/lab5.srcs/sources_1/bd/system/ipshared/818b/hdl/vhdl/hw_conv.vhd:1701]
INFO: [Synth 8-5534] Detected attribute (* fsm_encoding = "none" *) [c:/ece1195/labs/lab5/lab5_template/vivado/lab5/lab5.srcs/sources_1/bd/system/ipshared/818b/hdl/vhdl/hw_conv.vhd:1704]
INFO: [Synth 8-5534] Detected attribute (* fsm_encoding = "none" *) [c:/ece1195/labs/lab5/lab5_template/vivado/lab5/lab5.srcs/sources_1/bd/system/ipshared/818b/hdl/vhdl/hw_conv.vhd:1717]
INFO: [Synth 8-5534] Detected attribute (* fsm_encoding = "none" *) [c:/ece1195/labs/lab5/lab5_template/vivado/lab5/lab5.srcs/sources_1/bd/system/ipshared/818b/hdl/vhdl/hw_conv.vhd:1723]
INFO: [Synth 8-5534] Detected attribute (* fsm_encoding = "none" *) [c:/ece1195/labs/lab5/lab5_template/vivado/lab5/lab5.srcs/sources_1/bd/system/ipshared/818b/hdl/vhdl/hw_conv.vhd:1729]
INFO: [Synth 8-5534] Detected attribute (* fsm_encoding = "none" *) [c:/ece1195/labs/lab5/lab5_template/vivado/lab5/lab5.srcs/sources_1/bd/system/ipshared/818b/hdl/vhdl/hw_conv.vhd:1735]
INFO: [Synth 8-5534] Detected attribute (* fsm_encoding = "none" *) [c:/ece1195/labs/lab5/lab5_template/vivado/lab5/lab5.srcs/sources_1/bd/system/ipshared/818b/hdl/vhdl/hw_conv.vhd:1741]
INFO: [Synth 8-5534] Detected attribute (* fsm_encoding = "none" *) [c:/ece1195/labs/lab5/lab5_template/vivado/lab5/lab5.srcs/sources_1/bd/system/ipshared/818b/hdl/vhdl/hw_conv.vhd:1747]
INFO: [Synth 8-5534] Detected attribute (* fsm_encoding = "none" *) [c:/ece1195/labs/lab5/lab5_template/vivado/lab5/lab5.srcs/sources_1/bd/system/ipshared/818b/hdl/vhdl/hw_conv.vhd:1753]
INFO: [Synth 8-5534] Detected attribute (* fsm_encoding = "none" *) [c:/ece1195/labs/lab5/lab5_template/vivado/lab5/lab5.srcs/sources_1/bd/system/ipshared/818b/hdl/vhdl/hw_conv.vhd:1759]
INFO: [Synth 8-5534] Detected attribute (* fsm_encoding = "none" *) [c:/ece1195/labs/lab5/lab5_template/vivado/lab5/lab5.srcs/sources_1/bd/system/ipshared/818b/hdl/vhdl/hw_conv.vhd:1765]
INFO: [Synth 8-5534] Detected attribute (* fsm_encoding = "none" *) [c:/ece1195/labs/lab5/lab5_template/vivado/lab5/lab5.srcs/sources_1/bd/system/ipshared/818b/hdl/vhdl/hw_conv.vhd:1771]
INFO: [Synth 8-5534] Detected attribute (* fsm_encoding = "none" *) [c:/ece1195/labs/lab5/lab5_template/vivado/lab5/lab5.srcs/sources_1/bd/system/ipshared/818b/hdl/vhdl/hw_conv.vhd:1777]
INFO: [Synth 8-5534] Detected attribute (* fsm_encoding = "none" *) [c:/ece1195/labs/lab5/lab5_template/vivado/lab5/lab5.srcs/sources_1/bd/system/ipshared/818b/hdl/vhdl/hw_conv.vhd:1783]
INFO: [Synth 8-5534] Detected attribute (* fsm_encoding = "none" *) [c:/ece1195/labs/lab5/lab5_template/vivado/lab5/lab5.srcs/sources_1/bd/system/ipshared/818b/hdl/vhdl/hw_conv.vhd:1789]
INFO: [Synth 8-5534] Detected attribute (* fsm_encoding = "none" *) [c:/ece1195/labs/lab5/lab5_template/vivado/lab5/lab5.srcs/sources_1/bd/system/ipshared/818b/hdl/vhdl/hw_conv.vhd:1795]
INFO: [Synth 8-5534] Detected attribute (* fsm_encoding = "none" *) [c:/ece1195/labs/lab5/lab5_template/vivado/lab5/lab5.srcs/sources_1/bd/system/ipshared/818b/hdl/vhdl/hw_conv.vhd:1801]
INFO: [Synth 8-5534] Detected attribute (* fsm_encoding = "none" *) [c:/ece1195/labs/lab5/lab5_template/vivado/lab5/lab5.srcs/sources_1/bd/system/ipshared/818b/hdl/vhdl/hw_conv.vhd:1807]
INFO: [Synth 8-5534] Detected attribute (* fsm_encoding = "none" *) [c:/ece1195/labs/lab5/lab5_template/vivado/lab5/lab5.srcs/sources_1/bd/system/ipshared/818b/hdl/vhdl/hw_conv.vhd:1813]
INFO: [Synth 8-5534] Detected attribute (* fsm_encoding = "none" *) [c:/ece1195/labs/lab5/lab5_template/vivado/lab5/lab5.srcs/sources_1/bd/system/ipshared/818b/hdl/vhdl/hw_conv.vhd:1819]
INFO: [Synth 8-5534] Detected attribute (* fsm_encoding = "none" *) [c:/ece1195/labs/lab5/lab5_template/vivado/lab5/lab5.srcs/sources_1/bd/system/ipshared/818b/hdl/vhdl/hw_conv.vhd:1825]
INFO: [Synth 8-5534] Detected attribute (* fsm_encoding = "none" *) [c:/ece1195/labs/lab5/lab5_template/vivado/lab5/lab5.srcs/sources_1/bd/system/ipshared/818b/hdl/vhdl/hw_conv.vhd:1831]
INFO: [Synth 8-5534] Detected attribute (* fsm_encoding = "none" *) [c:/ece1195/labs/lab5/lab5_template/vivado/lab5/lab5.srcs/sources_1/bd/system/ipshared/818b/hdl/vhdl/hw_conv.vhd:1837]
INFO: [Synth 8-5534] Detected attribute (* fsm_encoding = "none" *) [c:/ece1195/labs/lab5/lab5_template/vivado/lab5/lab5.srcs/sources_1/bd/system/ipshared/818b/hdl/vhdl/hw_conv.vhd:1843]
INFO: [Synth 8-5534] Detected attribute (* fsm_encoding = "none" *) [c:/ece1195/labs/lab5/lab5_template/vivado/lab5/lab5.srcs/sources_1/bd/system/ipshared/818b/hdl/vhdl/hw_conv.vhd:1849]
INFO: [Synth 8-5534] Detected attribute (* fsm_encoding = "none" *) [c:/ece1195/labs/lab5/lab5_template/vivado/lab5/lab5.srcs/sources_1/bd/system/ipshared/818b/hdl/vhdl/hw_conv.vhd:1855]
INFO: [Synth 8-5534] Detected attribute (* fsm_encoding = "none" *) [c:/ece1195/labs/lab5/lab5_template/vivado/lab5/lab5.srcs/sources_1/bd/system/ipshared/818b/hdl/vhdl/hw_conv.vhd:1861]
INFO: [Synth 8-5534] Detected attribute (* fsm_encoding = "none" *) [c:/ece1195/labs/lab5/lab5_template/vivado/lab5/lab5.srcs/sources_1/bd/system/ipshared/818b/hdl/vhdl/hw_conv.vhd:1867]
INFO: [Synth 8-5534] Detected attribute (* fsm_encoding = "none" *) [c:/ece1195/labs/lab5/lab5_template/vivado/lab5/lab5.srcs/sources_1/bd/system/ipshared/818b/hdl/vhdl/hw_conv.vhd:1873]
INFO: [Synth 8-5534] Detected attribute (* fsm_encoding = "none" *) [c:/ece1195/labs/lab5/lab5_template/vivado/lab5/lab5.srcs/sources_1/bd/system/ipshared/818b/hdl/vhdl/hw_conv.vhd:1879]
INFO: [Synth 8-5534] Detected attribute (* fsm_encoding = "none" *) [c:/ece1195/labs/lab5/lab5_template/vivado/lab5/lab5.srcs/sources_1/bd/system/ipshared/818b/hdl/vhdl/hw_conv.vhd:1885]
INFO: [Synth 8-5534] Detected attribute (* fsm_encoding = "none" *) [c:/ece1195/labs/lab5/lab5_template/vivado/lab5/lab5.srcs/sources_1/bd/system/ipshared/818b/hdl/vhdl/hw_conv.vhd:1891]
INFO: [Synth 8-5534] Detected attribute (* fsm_encoding = "none" *) [c:/ece1195/labs/lab5/lab5_template/vivado/lab5/lab5.srcs/sources_1/bd/system/ipshared/818b/hdl/vhdl/hw_conv.vhd:1897]
INFO: [Synth 8-5534] Detected attribute (* fsm_encoding = "none" *) [c:/ece1195/labs/lab5/lab5_template/vivado/lab5/lab5.srcs/sources_1/bd/system/ipshared/818b/hdl/vhdl/hw_conv.vhd:1903]
INFO: [Synth 8-5534] Detected attribute (* fsm_encoding = "none" *) [c:/ece1195/labs/lab5/lab5_template/vivado/lab5/lab5.srcs/sources_1/bd/system/ipshared/818b/hdl/vhdl/hw_conv.vhd:1909]
INFO: [Synth 8-5534] Detected attribute (* fsm_encoding = "none" *) [c:/ece1195/labs/lab5/lab5_template/vivado/lab5/lab5.srcs/sources_1/bd/system/ipshared/818b/hdl/vhdl/hw_conv.vhd:1915]
INFO: [Synth 8-5534] Detected attribute (* fsm_encoding = "none" *) [c:/ece1195/labs/lab5/lab5_template/vivado/lab5/lab5.srcs/sources_1/bd/system/ipshared/818b/hdl/vhdl/hw_conv.vhd:1921]
INFO: [Synth 8-5534] Detected attribute (* fsm_encoding = "none" *) [c:/ece1195/labs/lab5/lab5_template/vivado/lab5/lab5.srcs/sources_1/bd/system/ipshared/818b/hdl/vhdl/hw_conv.vhd:1927]
INFO: [Synth 8-5534] Detected attribute (* fsm_encoding = "none" *) [c:/ece1195/labs/lab5/lab5_template/vivado/lab5/lab5.srcs/sources_1/bd/system/ipshared/818b/hdl/vhdl/hw_conv.vhd:1933]
INFO: [Synth 8-5534] Detected attribute (* fsm_encoding = "none" *) [c:/ece1195/labs/lab5/lab5_template/vivado/lab5/lab5.srcs/sources_1/bd/system/ipshared/818b/hdl/vhdl/hw_conv.vhd:1939]
INFO: [Synth 8-5534] Detected attribute (* fsm_encoding = "none" *) [c:/ece1195/labs/lab5/lab5_template/vivado/lab5/lab5.srcs/sources_1/bd/system/ipshared/818b/hdl/vhdl/hw_conv.vhd:1945]
INFO: [Synth 8-5534] Detected attribute (* fsm_encoding = "none" *) [c:/ece1195/labs/lab5/lab5_template/vivado/lab5/lab5.srcs/sources_1/bd/system/ipshared/818b/hdl/vhdl/hw_conv.vhd:1951]
INFO: [Synth 8-5534] Detected attribute (* fsm_encoding = "none" *) [c:/ece1195/labs/lab5/lab5_template/vivado/lab5/lab5.srcs/sources_1/bd/system/ipshared/818b/hdl/vhdl/hw_conv.vhd:1957]
INFO: [Synth 8-5534] Detected attribute (* fsm_encoding = "none" *) [c:/ece1195/labs/lab5/lab5_template/vivado/lab5/lab5.srcs/sources_1/bd/system/ipshared/818b/hdl/vhdl/hw_conv.vhd:1963]
INFO: [Synth 8-5534] Detected attribute (* fsm_encoding = "none" *) [c:/ece1195/labs/lab5/lab5_template/vivado/lab5/lab5.srcs/sources_1/bd/system/ipshared/818b/hdl/vhdl/hw_conv.vhd:1969]
INFO: [Synth 8-5534] Detected attribute (* fsm_encoding = "none" *) [c:/ece1195/labs/lab5/lab5_template/vivado/lab5/lab5.srcs/sources_1/bd/system/ipshared/818b/hdl/vhdl/hw_conv.vhd:1975]
INFO: [Synth 8-5534] Detected attribute (* fsm_encoding = "none" *) [c:/ece1195/labs/lab5/lab5_template/vivado/lab5/lab5.srcs/sources_1/bd/system/ipshared/818b/hdl/vhdl/hw_conv.vhd:1981]
INFO: [Synth 8-5534] Detected attribute (* fsm_encoding = "none" *) [c:/ece1195/labs/lab5/lab5_template/vivado/lab5/lab5.srcs/sources_1/bd/system/ipshared/818b/hdl/vhdl/hw_conv.vhd:1987]
INFO: [Synth 8-5534] Detected attribute (* fsm_encoding = "none" *) [c:/ece1195/labs/lab5/lab5_template/vivado/lab5/lab5.srcs/sources_1/bd/system/ipshared/818b/hdl/vhdl/hw_conv.vhd:1993]
INFO: [Synth 8-5534] Detected attribute (* fsm_encoding = "none" *) [c:/ece1195/labs/lab5/lab5_template/vivado/lab5/lab5.srcs/sources_1/bd/system/ipshared/818b/hdl/vhdl/hw_conv.vhd:1999]
INFO: [Synth 8-5534] Detected attribute (* fsm_encoding = "none" *) [c:/ece1195/labs/lab5/lab5_template/vivado/lab5/lab5.srcs/sources_1/bd/system/ipshared/818b/hdl/vhdl/hw_conv.vhd:2005]
INFO: [Synth 8-5534] Detected attribute (* fsm_encoding = "none" *) [c:/ece1195/labs/lab5/lab5_template/vivado/lab5/lab5.srcs/sources_1/bd/system/ipshared/818b/hdl/vhdl/hw_conv.vhd:2011]
INFO: [Synth 8-5534] Detected attribute (* fsm_encoding = "none" *) [c:/ece1195/labs/lab5/lab5_template/vivado/lab5/lab5.srcs/sources_1/bd/system/ipshared/818b/hdl/vhdl/hw_conv.vhd:2017]
INFO: [Synth 8-5534] Detected attribute (* fsm_encoding = "none" *) [c:/ece1195/labs/lab5/lab5_template/vivado/lab5/lab5.srcs/sources_1/bd/system/ipshared/818b/hdl/vhdl/hw_conv.vhd:2023]
INFO: [Synth 8-5534] Detected attribute (* fsm_encoding = "none" *) [c:/ece1195/labs/lab5/lab5_template/vivado/lab5/lab5.srcs/sources_1/bd/system/ipshared/818b/hdl/vhdl/hw_conv.vhd:2029]
INFO: [Synth 8-5534] Detected attribute (* fsm_encoding = "none" *) [c:/ece1195/labs/lab5/lab5_template/vivado/lab5/lab5.srcs/sources_1/bd/system/ipshared/818b/hdl/vhdl/hw_conv.vhd:2035]
INFO: [Synth 8-5534] Detected attribute (* fsm_encoding = "none" *) [c:/ece1195/labs/lab5/lab5_template/vivado/lab5/lab5.srcs/sources_1/bd/system/ipshared/818b/hdl/vhdl/hw_conv.vhd:2041]
INFO: [Synth 8-5534] Detected attribute (* fsm_encoding = "none" *) [c:/ece1195/labs/lab5/lab5_template/vivado/lab5/lab5.srcs/sources_1/bd/system/ipshared/818b/hdl/vhdl/hw_conv.vhd:2047]
INFO: [Synth 8-5534] Detected attribute (* fsm_encoding = "none" *) [c:/ece1195/labs/lab5/lab5_template/vivado/lab5/lab5.srcs/sources_1/bd/system/ipshared/818b/hdl/vhdl/hw_conv.vhd:2053]
INFO: [Synth 8-5534] Detected attribute (* fsm_encoding = "none" *) [c:/ece1195/labs/lab5/lab5_template/vivado/lab5/lab5.srcs/sources_1/bd/system/ipshared/818b/hdl/vhdl/hw_conv.vhd:2059]
INFO: [Synth 8-5534] Detected attribute (* fsm_encoding = "none" *) [c:/ece1195/labs/lab5/lab5_template/vivado/lab5/lab5.srcs/sources_1/bd/system/ipshared/818b/hdl/vhdl/hw_conv.vhd:2065]
INFO: [Synth 8-5534] Detected attribute (* fsm_encoding = "none" *) [c:/ece1195/labs/lab5/lab5_template/vivado/lab5/lab5.srcs/sources_1/bd/system/ipshared/818b/hdl/vhdl/hw_conv.vhd:2071]
INFO: [Synth 8-5534] Detected attribute (* fsm_encoding = "none" *) [c:/ece1195/labs/lab5/lab5_template/vivado/lab5/lab5.srcs/sources_1/bd/system/ipshared/818b/hdl/vhdl/hw_conv.vhd:2077]
INFO: [Synth 8-5534] Detected attribute (* fsm_encoding = "none" *) [c:/ece1195/labs/lab5/lab5_template/vivado/lab5/lab5.srcs/sources_1/bd/system/ipshared/818b/hdl/vhdl/hw_conv.vhd:2083]
INFO: [Synth 8-5534] Detected attribute (* fsm_encoding = "none" *) [c:/ece1195/labs/lab5/lab5_template/vivado/lab5/lab5.srcs/sources_1/bd/system/ipshared/818b/hdl/vhdl/hw_conv.vhd:2089]
INFO: [Synth 8-5534] Detected attribute (* fsm_encoding = "none" *) [c:/ece1195/labs/lab5/lab5_template/vivado/lab5/lab5.srcs/sources_1/bd/system/ipshared/818b/hdl/vhdl/hw_conv.vhd:2095]
INFO: [Synth 8-5534] Detected attribute (* fsm_encoding = "none" *) [c:/ece1195/labs/lab5/lab5_template/vivado/lab5/lab5.srcs/sources_1/bd/system/ipshared/818b/hdl/vhdl/hw_conv.vhd:2101]
INFO: [Synth 8-5534] Detected attribute (* fsm_encoding = "none" *) [c:/ece1195/labs/lab5/lab5_template/vivado/lab5/lab5.srcs/sources_1/bd/system/ipshared/818b/hdl/vhdl/hw_conv.vhd:2107]
INFO: [Synth 8-5534] Detected attribute (* fsm_encoding = "none" *) [c:/ece1195/labs/lab5/lab5_template/vivado/lab5/lab5.srcs/sources_1/bd/system/ipshared/818b/hdl/vhdl/hw_conv.vhd:2113]
INFO: [Synth 8-5534] Detected attribute (* fsm_encoding = "none" *) [c:/ece1195/labs/lab5/lab5_template/vivado/lab5/lab5.srcs/sources_1/bd/system/ipshared/818b/hdl/vhdl/hw_conv.vhd:2119]
INFO: [Synth 8-5534] Detected attribute (* fsm_encoding = "none" *) [c:/ece1195/labs/lab5/lab5_template/vivado/lab5/lab5.srcs/sources_1/bd/system/ipshared/818b/hdl/vhdl/hw_conv.vhd:2125]
INFO: [Synth 8-5534] Detected attribute (* fsm_encoding = "none" *) [c:/ece1195/labs/lab5/lab5_template/vivado/lab5/lab5.srcs/sources_1/bd/system/ipshared/818b/hdl/vhdl/hw_conv.vhd:2131]
INFO: [Synth 8-5534] Detected attribute (* fsm_encoding = "none" *) [c:/ece1195/labs/lab5/lab5_template/vivado/lab5/lab5.srcs/sources_1/bd/system/ipshared/818b/hdl/vhdl/hw_conv.vhd:2137]
INFO: [Synth 8-5534] Detected attribute (* fsm_encoding = "none" *) [c:/ece1195/labs/lab5/lab5_template/vivado/lab5/lab5.srcs/sources_1/bd/system/ipshared/818b/hdl/vhdl/hw_conv.vhd:2143]
INFO: [Synth 8-5534] Detected attribute (* fsm_encoding = "none" *) [c:/ece1195/labs/lab5/lab5_template/vivado/lab5/lab5.srcs/sources_1/bd/system/ipshared/818b/hdl/vhdl/hw_conv.vhd:2149]
INFO: [Synth 8-5534] Detected attribute (* fsm_encoding = "none" *) [c:/ece1195/labs/lab5/lab5_template/vivado/lab5/lab5.srcs/sources_1/bd/system/ipshared/818b/hdl/vhdl/hw_conv.vhd:2155]
INFO: [Synth 8-5534] Detected attribute (* fsm_encoding = "none" *) [c:/ece1195/labs/lab5/lab5_template/vivado/lab5/lab5.srcs/sources_1/bd/system/ipshared/818b/hdl/vhdl/hw_conv.vhd:2161]
INFO: [Synth 8-5534] Detected attribute (* fsm_encoding = "none" *) [c:/ece1195/labs/lab5/lab5_template/vivado/lab5/lab5.srcs/sources_1/bd/system/ipshared/818b/hdl/vhdl/hw_conv.vhd:2167]
INFO: [Synth 8-5534] Detected attribute (* fsm_encoding = "none" *) [c:/ece1195/labs/lab5/lab5_template/vivado/lab5/lab5.srcs/sources_1/bd/system/ipshared/818b/hdl/vhdl/hw_conv.vhd:2173]
INFO: [Synth 8-5534] Detected attribute (* fsm_encoding = "none" *) [c:/ece1195/labs/lab5/lab5_template/vivado/lab5/lab5.srcs/sources_1/bd/system/ipshared/818b/hdl/vhdl/hw_conv.vhd:2179]
INFO: [Synth 8-5534] Detected attribute (* fsm_encoding = "none" *) [c:/ece1195/labs/lab5/lab5_template/vivado/lab5/lab5.srcs/sources_1/bd/system/ipshared/818b/hdl/vhdl/hw_conv.vhd:2185]
INFO: [Synth 8-5534] Detected attribute (* fsm_encoding = "none" *) [c:/ece1195/labs/lab5/lab5_template/vivado/lab5/lab5.srcs/sources_1/bd/system/ipshared/818b/hdl/vhdl/hw_conv.vhd:2191]
INFO: [Synth 8-5534] Detected attribute (* fsm_encoding = "none" *) [c:/ece1195/labs/lab5/lab5_template/vivado/lab5/lab5.srcs/sources_1/bd/system/ipshared/818b/hdl/vhdl/hw_conv.vhd:2197]
INFO: [Synth 8-5534] Detected attribute (* fsm_encoding = "none" *) [c:/ece1195/labs/lab5/lab5_template/vivado/lab5/lab5.srcs/sources_1/bd/system/ipshared/818b/hdl/vhdl/hw_conv.vhd:2203]
INFO: [Synth 8-5534] Detected attribute (* fsm_encoding = "none" *) [c:/ece1195/labs/lab5/lab5_template/vivado/lab5/lab5.srcs/sources_1/bd/system/ipshared/818b/hdl/vhdl/hw_conv.vhd:2209]
INFO: [Synth 8-5534] Detected attribute (* fsm_encoding = "none" *) [c:/ece1195/labs/lab5/lab5_template/vivado/lab5/lab5.srcs/sources_1/bd/system/ipshared/818b/hdl/vhdl/hw_conv.vhd:2215]
INFO: [Synth 8-5534] Detected attribute (* fsm_encoding = "none" *) [c:/ece1195/labs/lab5/lab5_template/vivado/lab5/lab5.srcs/sources_1/bd/system/ipshared/818b/hdl/vhdl/hw_conv.vhd:2221]
INFO: [Synth 8-5534] Detected attribute (* fsm_encoding = "none" *) [c:/ece1195/labs/lab5/lab5_template/vivado/lab5/lab5.srcs/sources_1/bd/system/ipshared/818b/hdl/vhdl/hw_conv.vhd:2227]
INFO: [Synth 8-5534] Detected attribute (* fsm_encoding = "none" *) [c:/ece1195/labs/lab5/lab5_template/vivado/lab5/lab5.srcs/sources_1/bd/system/ipshared/818b/hdl/vhdl/hw_conv.vhd:2233]
INFO: [Synth 8-5534] Detected attribute (* fsm_encoding = "none" *) [c:/ece1195/labs/lab5/lab5_template/vivado/lab5/lab5.srcs/sources_1/bd/system/ipshared/818b/hdl/vhdl/hw_conv.vhd:2239]
INFO: [Synth 8-5534] Detected attribute (* fsm_encoding = "none" *) [c:/ece1195/labs/lab5/lab5_template/vivado/lab5/lab5.srcs/sources_1/bd/system/ipshared/818b/hdl/vhdl/hw_conv.vhd:2245]
INFO: [Synth 8-5534] Detected attribute (* fsm_encoding = "none" *) [c:/ece1195/labs/lab5/lab5_template/vivado/lab5/lab5.srcs/sources_1/bd/system/ipshared/818b/hdl/vhdl/hw_conv.vhd:2251]
INFO: [Synth 8-5534] Detected attribute (* fsm_encoding = "none" *) [c:/ece1195/labs/lab5/lab5_template/vivado/lab5/lab5.srcs/sources_1/bd/system/ipshared/818b/hdl/vhdl/hw_conv.vhd:2257]
INFO: [Synth 8-5534] Detected attribute (* fsm_encoding = "none" *) [c:/ece1195/labs/lab5/lab5_template/vivado/lab5/lab5.srcs/sources_1/bd/system/ipshared/818b/hdl/vhdl/hw_conv.vhd:2263]
INFO: [Common 17-14] Message 'Synth 8-5534' appears 100 times and further instances of the messages will be disabled. Use the Tcl command set_msg_config to change the current settings.
	Parameter DataWidth bound to: 8 - type: integer 
	Parameter AddressRange bound to: 509 - type: integer 
	Parameter AddressWidth bound to: 9 - type: integer 
INFO: [Synth 8-3491] module 'hw_conv_lbuf_0' declared at 'c:/ece1195/labs/lab5/lab5_template/vivado/lab5/lab5.srcs/sources_1/bd/system/ipshared/818b/hdl/vhdl/hw_conv_lbuf_0.vhd:105' bound to instance 'lbuf_0_U' of component 'hw_conv_lbuf_0' [c:/ece1195/labs/lab5/lab5_template/vivado/lab5/lab5.srcs/sources_1/bd/system/ipshared/818b/hdl/vhdl/hw_conv.vhd:3820]
INFO: [Synth 8-638] synthesizing module 'hw_conv_lbuf_0' [c:/ece1195/labs/lab5/lab5_template/vivado/lab5/lab5.srcs/sources_1/bd/system/ipshared/818b/hdl/vhdl/hw_conv_lbuf_0.vhd:125]
	Parameter DataWidth bound to: 8 - type: integer 
	Parameter AddressRange bound to: 509 - type: integer 
	Parameter AddressWidth bound to: 9 - type: integer 
INFO: [Synth 8-3491] module 'hw_conv_lbuf_0_ram' declared at 'c:/ece1195/labs/lab5/lab5_template/vivado/lab5/lab5.srcs/sources_1/bd/system/ipshared/818b/hdl/vhdl/hw_conv_lbuf_0.vhd:13' bound to instance 'hw_conv_lbuf_0_ram_U' of component 'hw_conv_lbuf_0_ram' [c:/ece1195/labs/lab5/lab5_template/vivado/lab5/lab5.srcs/sources_1/bd/system/ipshared/818b/hdl/vhdl/hw_conv_lbuf_0.vhd:144]
INFO: [Synth 8-638] synthesizing module 'hw_conv_lbuf_0_ram' [c:/ece1195/labs/lab5/lab5_template/vivado/lab5/lab5.srcs/sources_1/bd/system/ipshared/818b/hdl/vhdl/hw_conv_lbuf_0.vhd:36]
	Parameter MEM_TYPE bound to: block - type: string 
	Parameter DWIDTH bound to: 8 - type: integer 
	Parameter AWIDTH bound to: 9 - type: integer 
	Parameter MEM_SIZE bound to: 509 - type: integer 
INFO: [Synth 8-256] done synthesizing module 'hw_conv_lbuf_0_ram' (1#1) [c:/ece1195/labs/lab5/lab5_template/vivado/lab5/lab5.srcs/sources_1/bd/system/ipshared/818b/hdl/vhdl/hw_conv_lbuf_0.vhd:36]
INFO: [Synth 8-256] done synthesizing module 'hw_conv_lbuf_0' (2#1) [c:/ece1195/labs/lab5/lab5_template/vivado/lab5/lab5.srcs/sources_1/bd/system/ipshared/818b/hdl/vhdl/hw_conv_lbuf_0.vhd:125]
	Parameter DataWidth bound to: 8 - type: integer 
	Parameter AddressRange bound to: 509 - type: integer 
	Parameter AddressWidth bound to: 9 - type: integer 
INFO: [Synth 8-3491] module 'hw_conv_lbuf_0' declared at 'c:/ece1195/labs/lab5/lab5_template/vivado/lab5/lab5.srcs/sources_1/bd/system/ipshared/818b/hdl/vhdl/hw_conv_lbuf_0.vhd:105' bound to instance 'lbuf_1_U' of component 'hw_conv_lbuf_0' [c:/ece1195/labs/lab5/lab5_template/vivado/lab5/lab5.srcs/sources_1/bd/system/ipshared/818b/hdl/vhdl/hw_conv.vhd:3839]
WARNING: [Synth 8-6014] Unused sequential element sout_V_dest_V_1_sel_rd_reg was removed.  [c:/ece1195/labs/lab5/lab5_template/vivado/lab5/lab5.srcs/sources_1/bd/system/ipshared/818b/hdl/vhdl/hw_conv.vhd:3994]
WARNING: [Synth 8-6014] Unused sequential element sout_V_id_V_1_sel_rd_reg was removed.  [c:/ece1195/labs/lab5/lab5_template/vivado/lab5/lab5.srcs/sources_1/bd/system/ipshared/818b/hdl/vhdl/hw_conv.vhd:4028]
WARNING: [Synth 8-6014] Unused sequential element sout_V_keep_V_1_sel_rd_reg was removed.  [c:/ece1195/labs/lab5/lab5_template/vivado/lab5/lab5.srcs/sources_1/bd/system/ipshared/818b/hdl/vhdl/hw_conv.vhd:4062]
WARNING: [Synth 8-6014] Unused sequential element sout_V_strb_V_1_sel_rd_reg was removed.  [c:/ece1195/labs/lab5/lab5_template/vivado/lab5/lab5.srcs/sources_1/bd/system/ipshared/818b/hdl/vhdl/hw_conv.vhd:4144]
WARNING: [Synth 8-6014] Unused sequential element sout_V_user_V_1_sel_rd_reg was removed.  [c:/ece1195/labs/lab5/lab5_template/vivado/lab5/lab5.srcs/sources_1/bd/system/ipshared/818b/hdl/vhdl/hw_conv.vhd:4178]
INFO: [Synth 8-256] done synthesizing module 'hw_conv' (3#1) [c:/ece1195/labs/lab5/lab5_template/vivado/lab5/lab5.srcs/sources_1/bd/system/ipshared/818b/hdl/vhdl/hw_conv.vhd:37]
INFO: [Synth 8-256] done synthesizing module 'system_hw_conv_0_0' (4#1) [c:/ece1195/labs/lab5/lab5_template/vivado/lab5/lab5.srcs/sources_1/bd/system/ip/system_hw_conv_0_0/synth/system_hw_conv_0_0.vhd:81]
WARNING: [Synth 8-3331] design hw_conv_lbuf_0 has unconnected port reset
WARNING: [Synth 8-3331] design hw_conv has unconnected port sin_TKEEP[0]
WARNING: [Synth 8-3331] design hw_conv has unconnected port sin_TSTRB[0]
WARNING: [Synth 8-3331] design hw_conv has unconnected port sin_TUSER[0]
WARNING: [Synth 8-3331] design hw_conv has unconnected port sin_TLAST[0]
WARNING: [Synth 8-3331] design hw_conv has unconnected port sin_TID[0]
WARNING: [Synth 8-3331] design hw_conv has unconnected port sin_TDEST[0]
---------------------------------------------------------------------------------
Finished RTL Elaboration : Time (s): cpu = 00:11:54 ; elapsed = 00:12:08 . Memory (MB): peak = 1004.117 ; gain = 631.082
---------------------------------------------------------------------------------

Report Check Netlist: 
+------+------------------+-------+---------+-------+------------------+
|      |Item              |Errors |Warnings |Status |Description       |
+------+------------------+-------+---------+-------+------------------+
|1     |multi_driven_nets |      0|        0|Passed |Multi driven nets |
+------+------------------+-------+---------+-------+------------------+
---------------------------------------------------------------------------------
Start Handling Custom Attributes
---------------------------------------------------------------------------------
---------------------------------------------------------------------------------
Finished Handling Custom Attributes : Time (s): cpu = 00:11:55 ; elapsed = 00:12:14 . Memory (MB): peak = 1004.117 ; gain = 631.082
---------------------------------------------------------------------------------
---------------------------------------------------------------------------------
Finished RTL Optimization Phase 1 : Time (s): cpu = 00:11:55 ; elapsed = 00:12:14 . Memory (MB): peak = 1004.117 ; gain = 631.082
---------------------------------------------------------------------------------
INFO: [Device 21-403] Loading part xc7z020clg400-1
INFO: [Project 1-570] Preparing netlist for logic optimization

Processing XDC Constraints
Initializing timing engine
Parsing XDC File [c:/ece1195/labs/lab5/lab5_template/vivado/lab5/lab5.srcs/sources_1/bd/system/ip/system_hw_conv_0_0/constraints/hw_conv_ooc.xdc] for cell 'U0'
Finished Parsing XDC File [c:/ece1195/labs/lab5/lab5_template/vivado/lab5/lab5.srcs/sources_1/bd/system/ip/system_hw_conv_0_0/constraints/hw_conv_ooc.xdc] for cell 'U0'
Parsing XDC File [C:/ece1195/labs/lab5/lab5_template/vivado/lab5/lab5.runs/system_hw_conv_0_0_synth_1/dont_touch.xdc]
Finished Parsing XDC File [C:/ece1195/labs/lab5/lab5_template/vivado/lab5/lab5.runs/system_hw_conv_0_0_synth_1/dont_touch.xdc]
Completed Processing XDC Constraints

Netlist sorting complete. Time (s): cpu = 00:00:00 ; elapsed = 00:00:00.009 . Memory (MB): peak = 1309.988 ; gain = 0.000
INFO: [Project 1-111] Unisim Transformation Summary:
No Unisim elements were transformed.

Netlist sorting complete. Time (s): cpu = 00:00:00 ; elapsed = 00:00:00.005 . Memory (MB): peak = 1309.988 ; gain = 0.000
Constraint Validation Runtime : Time (s): cpu = 00:00:01 ; elapsed = 00:00:00.304 . Memory (MB): peak = 1309.988 ; gain = 0.000
---------------------------------------------------------------------------------
Finished Constraint Validation : Time (s): cpu = 00:12:21 ; elapsed = 00:13:05 . Memory (MB): peak = 1313.430 ; gain = 940.395
---------------------------------------------------------------------------------
---------------------------------------------------------------------------------
Start Loading Part and Timing Information
---------------------------------------------------------------------------------
Loading part: xc7z020clg400-1
---------------------------------------------------------------------------------
Finished Loading Part and Timing Information : Time (s): cpu = 00:12:21 ; elapsed = 00:13:05 . Memory (MB): peak = 1313.430 ; gain = 940.395
---------------------------------------------------------------------------------
---------------------------------------------------------------------------------
Start Applying 'set_property' XDC Constraints
---------------------------------------------------------------------------------
Applied set_property DONT_TOUCH = true for U0. (constraint file  C:/ece1195/labs/lab5/lab5_template/vivado/lab5/lab5.runs/system_hw_conv_0_0_synth_1/dont_touch.xdc, line 9).
---------------------------------------------------------------------------------
Finished applying 'set_property' XDC Constraints : Time (s): cpu = 00:12:21 ; elapsed = 00:13:05 . Memory (MB): peak = 1313.430 ; gain = 940.395
---------------------------------------------------------------------------------
INFO: [Synth 8-4471] merging register 'kbuf_1_0_s_fu_1124_reg[7:0]' into 'kbuf_1_0_load_5_reg_15304_reg[7:0]' [c:/ece1195/labs/lab5/lab5_template/vivado/lab5/lab5.srcs/sources_1/bd/system/ipshared/818b/hdl/vhdl/hw_conv.vhd:4238]
INFO: [Synth 8-4471] merging register 'kbuf_2_0_s_fu_1136_reg[7:0]' into 'kbuf_2_0_load_6_reg_15314_reg[7:0]' [c:/ece1195/labs/lab5/lab5_template/vivado/lab5/lab5.srcs/sources_1/bd/system/ipshared/818b/hdl/vhdl/hw_conv.vhd:4242]
INFO: [Synth 8-4490] FSM extraction disabled for register 'ap_CS_fsm_reg' through user attribute
INFO: [Synth 8-5546] ROM "exitcond1_fu_9423_p2" won't be mapped to RAM because it is too sparse
INFO: [Synth 8-5544] ROM "sin_V_data_V_0_state_cmp_full" won't be mapped to Block RAM because address size (2) smaller than threshold (5)
INFO: [Synth 8-5544] ROM "sout_V_data_V_1_state_cmp_full" won't be mapped to Block RAM because address size (2) smaller than threshold (5)
INFO: [Synth 8-5546] ROM "tmp_last_V_fu_9636_p2" won't be mapped to RAM because it is too sparse
INFO: [Synth 8-5544] ROM "sout_V_last_V_1_state_cmp_full" won't be mapped to Block RAM because address size (2) smaller than threshold (5)
INFO: [Synth 8-5546] ROM "exitcond1_fu_9423_p2" won't be mapped to RAM because it is too sparse
INFO: [Synth 8-5544] ROM "sin_V_data_V_0_state_cmp_full" won't be mapped to Block RAM because address size (2) smaller than threshold (5)
INFO: [Synth 8-5544] ROM "sout_V_data_V_1_state_cmp_full" won't be mapped to Block RAM because address size (2) smaller than threshold (5)
INFO: [Synth 8-5546] ROM "tmp_last_V_fu_9636_p2" won't be mapped to RAM because it is too sparse
INFO: [Synth 8-5544] ROM "sout_V_last_V_1_state_cmp_full" won't be mapped to Block RAM because address size (2) smaller than threshold (5)
INFO: [Synth 8-5544] ROM "lbuf_0_address1" won't be mapped to Block RAM because address size (1) smaller than threshold (5)
INFO: [Synth 8-5544] ROM "ap_NS_fsm" won't be mapped to Block RAM because address size (1) smaller than threshold (5)
INFO: [Synth 8-5544] ROM "ap_NS_fsm" won't be mapped to Block RAM because address size (1) smaller than threshold (5)
INFO: [Synth 8-5544] ROM "ap_NS_fsm" won't be mapped to Block RAM because address size (1) smaller than threshold (5)
INFO: [Synth 8-5544] ROM "ap_NS_fsm" won't be mapped to Block RAM because address size (1) smaller than threshold (5)
INFO: [Synth 8-5544] ROM "sin_V_data_V_0_state" won't be mapped to Block RAM because address size (1) smaller than threshold (5)
INFO: [Synth 8-5544] ROM "sin_V_data_V_0_state" won't be mapped to Block RAM because address size (1) smaller than threshold (5)
INFO: [Synth 8-5544] ROM "sin_V_dest_V_0_state" won't be mapped to Block RAM because address size (1) smaller than threshold (5)
INFO: [Synth 8-5544] ROM "sin_V_dest_V_0_state" won't be mapped to Block RAM because address size (1) smaller than threshold (5)
INFO: [Synth 8-5544] ROM "sout_V_data_V_1_state" won't be mapped to Block RAM because address size (1) smaller than threshold (5)
INFO: [Synth 8-5544] ROM "sout_V_data_V_1_state" won't be mapped to Block RAM because address size (1) smaller than threshold (5)
INFO: [Synth 8-5544] ROM "sout_V_dest_V_1_state" won't be mapped to Block RAM because address size (1) smaller than threshold (5)
INFO: [Synth 8-5544] ROM "sout_V_dest_V_1_state" won't be mapped to Block RAM because address size (1) smaller than threshold (5)
INFO: [Synth 8-5544] ROM "sout_V_id_V_1_state" won't be mapped to Block RAM because address size (1) smaller than threshold (5)
INFO: [Synth 8-5544] ROM "sout_V_id_V_1_state" won't be mapped to Block RAM because address size (1) smaller than threshold (5)
INFO: [Synth 8-5544] ROM "sout_V_keep_V_1_state" won't be mapped to Block RAM because address size (1) smaller than threshold (5)
INFO: [Synth 8-5544] ROM "sout_V_keep_V_1_state" won't be mapped to Block RAM because address size (1) smaller than threshold (5)
INFO: [Synth 8-5544] ROM "sout_V_last_V_1_state" won't be mapped to Block RAM because address size (1) smaller than threshold (5)
INFO: [Synth 8-5544] ROM "sout_V_last_V_1_state" won't be mapped to Block RAM because address size (1) smaller than threshold (5)
INFO: [Synth 8-5544] ROM "sout_V_strb_V_1_state" won't be mapped to Block RAM because address size (1) smaller than threshold (5)
INFO: [Synth 8-5544] ROM "sout_V_strb_V_1_state" won't be mapped to Block RAM because address size (1) smaller than threshold (5)
INFO: [Synth 8-5544] ROM "sout_V_user_V_1_state" won't be mapped to Block RAM because address size (1) smaller than threshold (5)
INFO: [Synth 8-5544] ROM "sout_V_user_V_1_state" won't be mapped to Block RAM because address size (1) smaller than threshold (5)
INFO: [Synth 8-3971] The signal ram_reg was recognized as a true dual port RAM template.
---------------------------------------------------------------------------------
Finished RTL Optimization Phase 2 : Time (s): cpu = 00:15:23 ; elapsed = 00:16:08 . Memory (MB): peak = 1313.430 ; gain = 940.395
---------------------------------------------------------------------------------

Report RTL Partitions: 
+------+--------------+------------+----------+
|      |RTL Partition |Replication |Instances |
+------+--------------+------------+----------+
|1     |hw_conv__GB0  |           1|     43026|
|2     |hw_conv__GB1  |           1|     13414|
|3     |hw_conv__GB2  |           1|     21012|
+------+--------------+------------+----------+
---------------------------------------------------------------------------------
Start RTL Component Statistics 
---------------------------------------------------------------------------------
Detailed RTL Component Info : 
+---Adders : 
	   2 Input     19 Bit       Adders := 1     
	   3 Input     12 Bit       Adders := 1     
	   5 Input     11 Bit       Adders := 1     
	   2 Input     11 Bit       Adders := 1     
	   2 Input     10 Bit       Adders := 1     
+---Registers : 
	               19 Bit    Registers := 2     
	               11 Bit    Registers := 2     
	               10 Bit    Registers := 1     
	                8 Bit    Registers := 1034  
	                2 Bit    Registers := 9     
	                1 Bit    Registers := 9     
+---RAMs : 
	               3K Bit         RAMs := 2     
+---Muxes : 
	   2 Input    512 Bit        Muxes := 2     
	 513 Input    512 Bit        Muxes := 1     
	 508 Input      9 Bit        Muxes := 1     
	 509 Input      9 Bit        Muxes := 1     
	 255 Input      9 Bit        Muxes := 1     
	   2 Input      8 Bit        Muxes := 3     
	   2 Input      4 Bit        Muxes := 1     
	   3 Input      3 Bit        Muxes := 1     
	   2 Input      2 Bit        Muxes := 9     
	   4 Input      2 Bit        Muxes := 9     
	   2 Input      1 Bit        Muxes := 16    
---------------------------------------------------------------------------------
Finished RTL Component Statistics 
---------------------------------------------------------------------------------
---------------------------------------------------------------------------------
Start RTL Hierarchical Component Statistics 
---------------------------------------------------------------------------------
Hierarchical RTL Component report 
Module hw_conv_lbuf_0_ram__1 
Detailed RTL Component Info : 
+---Registers : 
	                8 Bit    Registers := 2     
+---RAMs : 
	               3K Bit         RAMs := 1     
Module hw_conv_lbuf_0_ram 
Detailed RTL Component Info : 
+---Registers : 
	                8 Bit    Registers := 2     
+---RAMs : 
	               3K Bit         RAMs := 1     
Module hw_conv 
Detailed RTL Component Info : 
+---Adders : 
	   2 Input     19 Bit       Adders := 1     
	   3 Input     12 Bit       Adders := 1     
	   5 Input     11 Bit       Adders := 1     
	   2 Input     11 Bit       Adders := 1     
	   2 Input     10 Bit       Adders := 1     
+---Registers : 
	               19 Bit    Registers := 2     
	               11 Bit    Registers := 2     
	               10 Bit    Registers := 1     
	                8 Bit    Registers := 1030  
	                2 Bit    Registers := 9     
	                1 Bit    Registers := 9     
+---Muxes : 
	   2 Input    512 Bit        Muxes := 2     
	 513 Input    512 Bit        Muxes := 1     
	 508 Input      9 Bit        Muxes := 1     
	 509 Input      9 Bit        Muxes := 1     
	 255 Input      9 Bit        Muxes := 1     
	   2 Input      8 Bit        Muxes := 3     
	   2 Input      4 Bit        Muxes := 1     
	   3 Input      3 Bit        Muxes := 1     
	   2 Input      2 Bit        Muxes := 9     
	   4 Input      2 Bit        Muxes := 9     
	   2 Input      1 Bit        Muxes := 16    
---------------------------------------------------------------------------------
Finished RTL Hierarchical Component Statistics
---------------------------------------------------------------------------------
---------------------------------------------------------------------------------
Start Part Resource Summary
---------------------------------------------------------------------------------
Part Resources:
DSPs: 220 (col length:60)
BRAMs: 280 (col length: RAMB18 60 RAMB36 30)
---------------------------------------------------------------------------------
Finished Part Resource Summary
---------------------------------------------------------------------------------
---------------------------------------------------------------------------------
Start Cross Boundary and Area Optimization
---------------------------------------------------------------------------------
Warning: Parallel synthesis criteria is not met 
INFO: [Synth 8-5546] ROM "tmp_last_V_fu_9636_p2" won't be mapped to RAM because it is too sparse
INFO: [Synth 8-5546] ROM "exitcond1_fu_9423_p2" won't be mapped to RAM because it is too sparse
WARNING: [Synth 8-3331] design hw_conv has unconnected port sin_TKEEP[0]
WARNING: [Synth 8-3331] design hw_conv has unconnected port sin_TSTRB[0]
WARNING: [Synth 8-3331] design hw_conv has unconnected port sin_TUSER[0]
WARNING: [Synth 8-3331] design hw_conv has unconnected port sin_TLAST[0]
WARNING: [Synth 8-3331] design hw_conv has unconnected port sin_TID[0]
WARNING: [Synth 8-3331] design hw_conv has unconnected port sin_TDEST[0]
INFO: [Synth 8-3971] The signal lbuf_1_U/hw_conv_lbuf_0_ram_U/ram_reg was recognized as a true dual port RAM template.
INFO: [Synth 8-3971] The signal lbuf_0_U/hw_conv_lbuf_0_ram_U/ram_reg was recognized as a true dual port RAM template.
---------------------------------------------------------------------------------
Finished Cross Boundary and Area Optimization : Time (s): cpu = 00:19:24 ; elapsed = 00:20:13 . Memory (MB): peak = 1313.430 ; gain = 940.395
---------------------------------------------------------------------------------
---------------------------------------------------------------------------------
Start ROM, RAM, DSP and Shift Register Reporting
---------------------------------------------------------------------------------

Block RAM: Preliminary Mapping  Report (see note below)
+--------------------+------------+------------------------+---+---+------------------------+---+---+------------------+--------+--------+
|Module Name         | RTL Object | PORT A (Depth x Width) | W | R | PORT B (Depth x Width) | W | R | Ports driving FF | RAMB18 | RAMB36 | 
+--------------------+------------+------------------------+---+---+------------------------+---+---+------------------+--------+--------+
|hw_conv_lbuf_0_ram: | ram_reg    | 512 x 8(WRITE_FIRST)   | W | R | 512 x 8(WRITE_FIRST)   | W | R | Port A and B     | 1      | 0      | 
+--------------------+------------+------------------------+---+---+------------------------+---+---+------------------+--------+--------+

Note: The table above is a preliminary report that shows the Block RAMs at the current stage of the synthesis flow. Some Block RAMs may be reimplemented as non Block RAM primitives later in the synthesis flow. Multiple instantiated Block RAMs are reported only once. 
---------------------------------------------------------------------------------
Finished ROM, RAM, DSP and Shift Register Reporting
---------------------------------------------------------------------------------
INFO: [Synth 8-6837] The timing for the instance U0/i_2_1/i_2_0/lbuf_0_U/hw_conv_lbuf_0_ram_U/ram_reg (implemented as a Block RAM) might be sub-optimal as no optional output register could be merged into the block ram. Providing additional output register may help in improving timing.
INFO: [Synth 8-6837] The timing for the instance U0/i_2_1/i_2_0/lbuf_0_U/hw_conv_lbuf_0_ram_U/ram_reg (implemented as a Block RAM) might be sub-optimal as no optional output register could be merged into the block ram. Providing additional output register may help in improving timing.

Report RTL Partitions: 
+------+--------------+------------+----------+
|      |RTL Partition |Replication |Instances |
+------+--------------+------------+----------+
|1     |hw_conv__GB0  |           1|      9333|
|2     |hw_conv__GB1  |           1|      7605|
|3     |hw_conv__GB2  |           1|      1904|
+------+--------------+------------+----------+
---------------------------------------------------------------------------------
Start Applying XDC Timing Constraints
---------------------------------------------------------------------------------
---------------------------------------------------------------------------------
Finished Applying XDC Timing Constraints : Time (s): cpu = 00:19:35 ; elapsed = 00:20:25 . Memory (MB): peak = 1313.430 ; gain = 940.395
---------------------------------------------------------------------------------
---------------------------------------------------------------------------------
Start Timing Optimization
---------------------------------------------------------------------------------
---------------------------------------------------------------------------------
Finished Timing Optimization : Time (s): cpu = 00:20:23 ; elapsed = 00:21:16 . Memory (MB): peak = 1313.430 ; gain = 940.395
---------------------------------------------------------------------------------
---------------------------------------------------------------------------------
Start ROM, RAM, DSP and Shift Register Reporting
---------------------------------------------------------------------------------

Block RAM: Final Mapping  Report
+--------------------+------------+------------------------+---+---+------------------------+---+---+------------------+--------+--------+
|Module Name         | RTL Object | PORT A (Depth x Width) | W | R | PORT B (Depth x Width) | W | R | Ports driving FF | RAMB18 | RAMB36 | 
+--------------------+------------+------------------------+---+---+------------------------+---+---+------------------+--------+--------+
|hw_conv_lbuf_0_ram: | ram_reg    | 512 x 8(WRITE_FIRST)   | W | R | 512 x 8(WRITE_FIRST)   | W | R | Port A and B     | 1      | 0      | 
+--------------------+------------+------------------------+---+---+------------------------+---+---+------------------+--------+--------+

---------------------------------------------------------------------------------
Finished ROM, RAM, DSP and Shift Register Reporting
---------------------------------------------------------------------------------

Report RTL Partitions: 
+------+--------------+------------+----------+
|      |RTL Partition |Replication |Instances |
+------+--------------+------------+----------+
|1     |hw_conv_GT0   |           1|     17685|
+------+--------------+------------+----------+
---------------------------------------------------------------------------------
Start Technology Mapping
---------------------------------------------------------------------------------
INFO: [Synth 8-6837] The timing for the instance U0/lbuf_0_U/hw_conv_lbuf_0_ram_U/ram_reg (implemented as a Block RAM) might be sub-optimal as no optional output register could be merged into the block ram. Providing additional output register may help in improving timing.
INFO: [Synth 8-6837] The timing for the instance U0/lbuf_0_U/hw_conv_lbuf_0_ram_U/ram_reg (implemented as a Block RAM) might be sub-optimal as no optional output register could be merged into the block ram. Providing additional output register may help in improving timing.
---------------------------------------------------------------------------------
Finished Technology Mapping : Time (s): cpu = 00:20:30 ; elapsed = 00:21:23 . Memory (MB): peak = 1313.430 ; gain = 940.395
---------------------------------------------------------------------------------

Report RTL Partitions: 
+-+--------------+------------+----------+
| |RTL Partition |Replication |Instances |
+-+--------------+------------+----------+
+-+--------------+------------+----------+
---------------------------------------------------------------------------------
Start IO Insertion
---------------------------------------------------------------------------------
---------------------------------------------------------------------------------
Start Flattening Before IO Insertion
---------------------------------------------------------------------------------
---------------------------------------------------------------------------------
Finished Flattening Before IO Insertion
---------------------------------------------------------------------------------
---------------------------------------------------------------------------------
Start Final Netlist Cleanup
---------------------------------------------------------------------------------
---------------------------------------------------------------------------------
Finished Final Netlist Cleanup
---------------------------------------------------------------------------------
---------------------------------------------------------------------------------
Finished IO Insertion : Time (s): cpu = 00:20:32 ; elapsed = 00:21:25 . Memory (MB): peak = 1313.430 ; gain = 940.395
---------------------------------------------------------------------------------

Report Check Netlist: 
+------+------------------+-------+---------+-------+------------------+
|      |Item              |Errors |Warnings |Status |Description       |
+------+------------------+-------+---------+-------+------------------+
|1     |multi_driven_nets |      0|        0|Passed |Multi driven nets |
+------+------------------+-------+---------+-------+------------------+
---------------------------------------------------------------------------------
Start Renaming Generated Instances
---------------------------------------------------------------------------------
---------------------------------------------------------------------------------
Finished Renaming Generated Instances : Time (s): cpu = 00:20:32 ; elapsed = 00:21:25 . Memory (MB): peak = 1313.430 ; gain = 940.395
---------------------------------------------------------------------------------

Report RTL Partitions: 
+-+--------------+------------+----------+
| |RTL Partition |Replication |Instances |
+-+--------------+------------+----------+
+-+--------------+------------+----------+
---------------------------------------------------------------------------------
Start Rebuilding User Hierarchy
---------------------------------------------------------------------------------
---------------------------------------------------------------------------------
Finished Rebuilding User Hierarchy : Time (s): cpu = 00:20:33 ; elapsed = 00:21:26 . Memory (MB): peak = 1313.430 ; gain = 940.395
---------------------------------------------------------------------------------
---------------------------------------------------------------------------------
Start Renaming Generated Ports
---------------------------------------------------------------------------------
---------------------------------------------------------------------------------
Finished Renaming Generated Ports : Time (s): cpu = 00:20:33 ; elapsed = 00:21:26 . Memory (MB): peak = 1313.430 ; gain = 940.395
---------------------------------------------------------------------------------
---------------------------------------------------------------------------------
Start Handling Custom Attributes
---------------------------------------------------------------------------------
---------------------------------------------------------------------------------
Finished Handling Custom Attributes : Time (s): cpu = 00:20:33 ; elapsed = 00:21:26 . Memory (MB): peak = 1313.430 ; gain = 940.395
---------------------------------------------------------------------------------
---------------------------------------------------------------------------------
Start Renaming Generated Nets
---------------------------------------------------------------------------------
---------------------------------------------------------------------------------
Finished Renaming Generated Nets : Time (s): cpu = 00:20:33 ; elapsed = 00:21:26 . Memory (MB): peak = 1313.430 ; gain = 940.395
---------------------------------------------------------------------------------
---------------------------------------------------------------------------------
Start Writing Synthesis Report
---------------------------------------------------------------------------------

Report BlackBoxes: 
+-+--------------+----------+
| |BlackBox name |Instances |
+-+--------------+----------+
+-+--------------+----------+

Report Cell Usage: 
+------+---------+------+
|      |Cell     |Count |
+------+---------+------+
|1     |CARRY4   |    20|
|2     |LUT1     |     2|
|3     |LUT2     |   165|
|4     |LUT3     |   152|
|5     |LUT4     |   257|
|6     |LUT5     |   379|
|7     |LUT6     |  2283|
|8     |MUXF7    |     9|
|9     |RAMB18E1 |     1|
|10    |FDRE     |  4789|
|11    |FDSE     |     1|
+------+---------+------+

Report Instance Areas: 
+------+---------------------------+-------------------+------+
|      |Instance                   |Module             |Cells |
+------+---------------------------+-------------------+------+
|1     |top                        |                   |  8058|
|2     |  U0                       |hw_conv            |  8058|
|3     |    lbuf_0_U               |hw_conv_lbuf_0     |  3112|
|4     |      hw_conv_lbuf_0_ram_U |hw_conv_lbuf_0_ram |  3112|
+------+---------------------------+-------------------+------+
---------------------------------------------------------------------------------
Finished Writing Synthesis Report : Time (s): cpu = 00:20:33 ; elapsed = 00:21:26 . Memory (MB): peak = 1313.430 ; gain = 940.395
---------------------------------------------------------------------------------
Synthesis finished with 0 errors, 0 critical warnings and 6 warnings.
Synthesis Optimization Runtime : Time (s): cpu = 00:08:15 ; elapsed = 00:20:40 . Memory (MB): peak = 1313.430 ; gain = 631.082
Synthesis Optimization Complete : Time (s): cpu = 00:20:33 ; elapsed = 00:21:26 . Memory (MB): peak = 1313.430 ; gain = 940.395
INFO: [Project 1-571] Translating synthesized netlist
INFO: [Netlist 29-17] Analyzing 30 Unisim elements for replacement
INFO: [Netlist 29-28] Unisim Transformation completed in 0 CPU seconds
INFO: [Project 1-570] Preparing netlist for logic optimization
INFO: [Opt 31-138] Pushed 0 inverter(s) to 0 load pin(s).
Netlist sorting complete. Time (s): cpu = 00:00:00 ; elapsed = 00:00:00.002 . Memory (MB): peak = 1313.430 ; gain = 0.000
INFO: [Project 1-111] Unisim Transformation Summary:
No Unisim elements were transformed.

INFO: [Common 17-83] Releasing license: Synthesis
173 Infos, 18 Warnings, 0 Critical Warnings and 0 Errors encountered.
synth_design completed successfully
synth_design: Time (s): cpu = 00:20:37 ; elapsed = 00:21:36 . Memory (MB): peak = 1313.430 ; gain = 951.867
Netlist sorting complete. Time (s): cpu = 00:00:00 ; elapsed = 00:00:00.002 . Memory (MB): peak = 1313.430 ; gain = 0.000
WARNING: [Constraints 18-5210] No constraints selected for write.
Resolution: This message can indicate that there are no constraints for the design, or it can indicate that the used_in flags are set such that the constraints are ignored. This later case is used when running synth_design to not write synthesis constraints to the resulting checkpoint. Instead, project constraints are read when the synthesized design is opened.
INFO: [Common 17-1381] The checkpoint 'C:/ece1195/labs/lab5/lab5_template/vivado/lab5/lab5.runs/system_hw_conv_0_0_synth_1/system_hw_conv_0_0.dcp' has been generated.
write_checkpoint: Time (s): cpu = 00:00:03 ; elapsed = 00:00:07 . Memory (MB): peak = 1313.430 ; gain = 0.000
INFO: [Coretcl 2-1648] Added synthesis output to IP cache for IP system_hw_conv_0_0, cache-ID = 57687922fecf3f57
INFO: [Coretcl 2-1174] Renamed 3 cell refs.
Netlist sorting complete. Time (s): cpu = 00:00:00 ; elapsed = 00:00:00.003 . Memory (MB): peak = 1313.430 ; gain = 0.000
WARNING: [Constraints 18-5210] No constraints selected for write.
Resolution: This message can indicate that there are no constraints for the design, or it can indicate that the used_in flags are set such that the constraints are ignored. This later case is used when running synth_design to not write synthesis constraints to the resulting checkpoint. Instead, project constraints are read when the synthesized design is opened.
INFO: [Common 17-1381] The checkpoint 'C:/ece1195/labs/lab5/lab5_template/vivado/lab5/lab5.runs/system_hw_conv_0_0_synth_1/system_hw_conv_0_0.dcp' has been generated.
INFO: [runtcl-4] Executing : report_utilization -file system_hw_conv_0_0_utilization_synth.rpt -pb system_hw_conv_0_0_utilization_synth.pb
INFO: [Common 17-206] Exiting Vivado at Sun Apr 11 13:11:13 2021...
